{
  "$schema": "../schema/provenance.schema.json",
  "schemaVersion": "1.0.0",
  "source": "locales/ru/CONSTITUTION_CODE.md",
  "sourceSha256": "864bf72a9072d394d77d09de40089f8f0f3ecc0ff8f77c41ef173f0852adf2ee",
  "provisionNamespace": "kc",
  "provisionCount": 334,
  "derivedFrom": [],
  "retiredIds": []
}
